{
  "format": "openturbine-pcb-profile",
  "format_version": {
    "major": 1,
    "minor": 1
  },
  "board": {
    "id": "openturbine-s3-20261028",
    "name": "OpenTurbine PCB",
    "revision": "1.0-20261028",
    "manufacturer": "OpenTurbine",
    "description": "28 Oct 2026; ESP32-S3-WROOM-1-N8; all parts fitted; OpenTurbine 2.6.1 required"
  },
  "target": {
    "chip": "esp32-s3",
    "minimum_flash_mb": 8,
    "reviewed_strapping_gpio": [
      3,
      45,
      46
    ]
  },
  "buses": [
    {
      "id": "sensor_i2c",
      "kind": "i2c",
      "pins": {
        "sda": 4,
        "scl": 5
      },
      "frequency_hz": 400000
    },
    {
      "id": "thermocouple_spi",
      "kind": "spi",
      "pins": {
        "sck": 12,
        "miso": 13,
        "mosi": 11
      }
    },
    {
      "id": "serial_0",
      "kind": "uart",
      "pins": {
        "tx": 43,
        "rx": 44
      }
    }
  ],
  "devices": [
    {
      "id": "tc1",
      "driver": "max31856",
      "bus": "thermocouple_spi",
      "select": {
        "gpio": 14
      },
      "expected": true
    },
    {
      "id": "tc2",
      "driver": "max31856",
      "bus": "thermocouple_spi",
      "select": {
        "gpio": 3
      },
      "expected": true
    },
    {
      "id": "adc",
      "driver": "tla2528",
      "bus": "sensor_i2c",
      "address": 16,
      "expected": true
    },
    {
      "id": "io",
      "driver": "tca9534",
      "bus": "sensor_i2c",
      "address": 32,
      "expected": true
    }
  ],
  "fixed_functions": {
    "status_led": {
      "device": "io",
      "channel": 6,
      "active_high": false,
      "safe_demand": 0
    },
    "fault_led": {
      "device": "io",
      "channel": 7,
      "active_high": false,
      "safe_demand": 0
    },
    "output_enable": {
      "gpio": 45,
      "active_high": true,
      "safe_demand": 0
    },
    "supply_voltage": {
      "gpio": 10,
      "divider": 37,
      "reference_mv": 3300,
      "label": "ECU supply voltage"
    },
    "mavlink": {
      "bus": "serial_0"
    }
  },
  "ports": [
    {
      "id": "thermocouple_1",
      "label": "Thermocouple 1",
      "connector": "J43",
      "modes": [
        {
          "id": "temperature",
          "adapter": "spi_thermocouple",
          "device": "tc1"
        }
      ]
    },
    {
      "id": "thermocouple_2",
      "label": "Thermocouple 2",
      "connector": "J44",
      "modes": [
        {
          "id": "temperature",
          "adapter": "spi_thermocouple",
          "device": "tc2"
        }
      ]
    },
    {
      "id": "analog_1",
      "label": "ADC 1",
      "connector": "J20",
      "description": "0–5 V input via 1 kΩ; ADC reference is the 5 V analog rail",
      "modes": [
        {
          "id": "analog",
          "adapter": "i2c_adc_input",
          "device": "adc",
          "channel": 0,
          "reference_mv": 5000,
          "limits": {
            "minimum_mv": 0,
            "maximum_mv": 5000
          }
        },
        {
          "id": "switch",
          "adapter": "i2c_adc_digital_input",
          "device": "adc",
          "channel": 0,
          "reference_mv": 5000
        }
      ]
    },
    {
      "id": "analog_2",
      "label": "ADC 2",
      "connector": "J21",
      "description": "0–5 V input via 1 kΩ; ADC reference is the 5 V analog rail",
      "modes": [
        {
          "id": "analog",
          "adapter": "i2c_adc_input",
          "device": "adc",
          "channel": 1,
          "reference_mv": 5000,
          "limits": {
            "minimum_mv": 0,
            "maximum_mv": 5000
          }
        },
        {
          "id": "switch",
          "adapter": "i2c_adc_digital_input",
          "device": "adc",
          "channel": 1,
          "reference_mv": 5000
        }
      ]
    },
    {
      "id": "analog_3",
      "label": "ADC 3",
      "connector": "J22",
      "description": "0–5 V input via 1 kΩ; ADC reference is the 5 V analog rail",
      "modes": [
        {
          "id": "analog",
          "adapter": "i2c_adc_input",
          "device": "adc",
          "channel": 2,
          "reference_mv": 5000,
          "limits": {
            "minimum_mv": 0,
            "maximum_mv": 5000
          }
        },
        {
          "id": "switch",
          "adapter": "i2c_adc_digital_input",
          "device": "adc",
          "channel": 2,
          "reference_mv": 5000
        }
      ]
    },
    {
      "id": "analog_4",
      "label": "ADC 4",
      "connector": "J23",
      "description": "0–5 V input via 1 kΩ; ADC reference is the 5 V analog rail",
      "modes": [
        {
          "id": "analog",
          "adapter": "i2c_adc_input",
          "device": "adc",
          "channel": 3,
          "reference_mv": 5000,
          "limits": {
            "minimum_mv": 0,
            "maximum_mv": 5000
          }
        },
        {
          "id": "switch",
          "adapter": "i2c_adc_digital_input",
          "device": "adc",
          "channel": 3,
          "reference_mv": 5000
        }
      ]
    },
    {
      "id": "analog_5",
      "label": "ADC 5",
      "connector": "J24",
      "description": "0–5 V input via 1 kΩ; ADC reference is the 5 V analog rail",
      "modes": [
        {
          "id": "analog",
          "adapter": "i2c_adc_input",
          "device": "adc",
          "channel": 4,
          "reference_mv": 5000,
          "limits": {
            "minimum_mv": 0,
            "maximum_mv": 5000
          }
        },
        {
          "id": "switch",
          "adapter": "i2c_adc_digital_input",
          "device": "adc",
          "channel": 4,
          "reference_mv": 5000
        }
      ]
    },
    {
      "id": "analog_6",
      "label": "ADC 6",
      "connector": "J25",
      "description": "0–5 V input via 1 kΩ; ADC reference is the 5 V analog rail",
      "modes": [
        {
          "id": "analog",
          "adapter": "i2c_adc_input",
          "device": "adc",
          "channel": 5,
          "reference_mv": 5000,
          "limits": {
            "minimum_mv": 0,
            "maximum_mv": 5000
          }
        },
        {
          "id": "switch",
          "adapter": "i2c_adc_digital_input",
          "device": "adc",
          "channel": 5,
          "reference_mv": 5000
        }
      ]
    },
    {
      "id": "analog_7",
      "label": "ADC 7",
      "connector": "J26",
      "description": "0–5 V input via 1 kΩ; ADC reference is the 5 V analog rail",
      "modes": [
        {
          "id": "analog",
          "adapter": "i2c_adc_input",
          "device": "adc",
          "channel": 6,
          "reference_mv": 5000,
          "limits": {
            "minimum_mv": 0,
            "maximum_mv": 5000
          }
        },
        {
          "id": "switch",
          "adapter": "i2c_adc_digital_input",
          "device": "adc",
          "channel": 6,
          "reference_mv": 5000
        }
      ]
    },
    {
      "id": "analog_8",
      "label": "ADC 8",
      "connector": "J27",
      "description": "0–5 V input via 1 kΩ; ADC reference is the 5 V analog rail",
      "modes": [
        {
          "id": "analog",
          "adapter": "i2c_adc_input",
          "device": "adc",
          "channel": 7,
          "reference_mv": 5000,
          "limits": {
            "minimum_mv": 0,
            "maximum_mv": 5000
          }
        },
        {
          "id": "switch",
          "adapter": "i2c_adc_digital_input",
          "device": "adc",
          "channel": 7,
          "reference_mv": 5000
        }
      ]
    },
    {
      "id": "pulse_in_1",
      "label": "Input 1",
      "connector": "J28",
      "description": "Conditioned input; switchable external 3.3 V pull-up",
      "modes": [
        {
          "id": "frequency",
          "adapter": "pcnt_input",
          "endpoint": {
            "gpio": 35
          },
          "pull": "none",
          "pull_control": {
            "device": "io",
            "channel": 0,
            "active_high": false
          }
        },
        {
          "id": "rc",
          "adapter": "rc_pwm_input",
          "endpoint": {
            "gpio": 35
          },
          "pull": "none",
          "pull_control": {
            "device": "io",
            "channel": 0,
            "active_high": false
          }
        },
        {
          "id": "duty",
          "adapter": "pwm_duty_input",
          "endpoint": {
            "gpio": 35
          },
          "pull": "none",
          "pull_control": {
            "device": "io",
            "channel": 0,
            "active_high": false
          }
        },
        {
          "id": "switch",
          "adapter": "digital_input",
          "endpoint": {
            "gpio": 35
          },
          "pull": "none",
          "pull_control": {
            "device": "io",
            "channel": 0,
            "active_high": false
          }
        }
      ]
    },
    {
      "id": "pulse_in_2",
      "label": "Input 2",
      "connector": "J29",
      "description": "Conditioned input; switchable external 3.3 V pull-up",
      "modes": [
        {
          "id": "frequency",
          "adapter": "pcnt_input",
          "endpoint": {
            "gpio": 36
          },
          "pull": "none",
          "pull_control": {
            "device": "io",
            "channel": 1,
            "active_high": false
          }
        },
        {
          "id": "rc",
          "adapter": "rc_pwm_input",
          "endpoint": {
            "gpio": 36
          },
          "pull": "none",
          "pull_control": {
            "device": "io",
            "channel": 1,
            "active_high": false
          }
        },
        {
          "id": "duty",
          "adapter": "pwm_duty_input",
          "endpoint": {
            "gpio": 36
          },
          "pull": "none",
          "pull_control": {
            "device": "io",